{
  "schemaVersion": 2,
  "kind": "cots.workflow-bundle",
  "workflow": {
    "name": "Complex Payment Platform",
    "description": "Full provider-matrix fixture covering a payment API, asynchronous settlement, durable state, caches, audit history, and messaging.",
    "nodes": [
      {
        "id": "payment-api-node",
        "type": "serviceNode",
        "position": { "x": 40, "y": 260 },
        "data": {
          "label": "payment_api",
          "service": {
            "type": "generic",
            "image": "tokyo-test-api:latest",
            "ports": [{ "id": "payment-http", "hostPort": "", "containerPort": "8080" }],
            "env": [
              { "id": "pa-role", "key": "APP_ROLE", "value": "payment-api" },
              { "id": "pa-port", "key": "PORT", "value": "8080" },
              { "id": "pa-pg-host", "key": "POSTGRES_HOST", "value": "${ledger_postgres.host}" },
              { "id": "pa-pg-port", "key": "POSTGRES_PORT", "value": "5432" },
              { "id": "pa-pg-db", "key": "POSTGRES_DB", "value": "payments" },
              { "id": "pa-pg-user", "key": "POSTGRES_USER", "value": "payments" },
              { "id": "pa-pg-pass", "key": "POSTGRES_PASSWORD", "value": "payments" },
              { "id": "pa-my-host", "key": "MYSQL_HOST", "value": "${merchant_mysql.host}" },
              { "id": "pa-my-port", "key": "MYSQL_PORT", "value": "3306" },
              { "id": "pa-my-db", "key": "MYSQL_DB", "value": "merchants" },
              { "id": "pa-my-user", "key": "MYSQL_USER", "value": "payments" },
              { "id": "pa-my-pass", "key": "MYSQL_PASSWORD", "value": "payments" },
              { "id": "pa-ma-host", "key": "MARIA_HOST", "value": "${risk_mariadb.host}" },
              { "id": "pa-ma-port", "key": "MARIA_PORT", "value": "3306" },
              { "id": "pa-ma-db", "key": "MARIA_DB", "value": "risk" },
              { "id": "pa-ma-user", "key": "MARIA_USER", "value": "payments" },
              { "id": "pa-ma-pass", "key": "MARIA_PASSWORD", "value": "payments" },
              { "id": "pa-red-host", "key": "REDIS_HOST", "value": "${redis_cache.host}" },
              { "id": "pa-red-port", "key": "REDIS_PORT", "value": "6379" },
              { "id": "pa-mem", "key": "MEMCACHED_SERVERS", "value": "${memcached_cache.host}:11211" },
              { "id": "pa-mongo", "key": "MONGODB_URI", "value": "mongodb://audit:audit@${audit_mongodb.host}:27017/?authSource=admin" },
              { "id": "pa-mongo-db", "key": "MONGODB_DATABASE", "value": "payments_audit" },
              { "id": "pa-rabbit", "key": "RABBITMQ_URL", "value": "amqp://payments:payments@${settlement_rabbitmq.host}:5672/" },
              { "id": "pa-rabbit-q", "key": "RABBITMQ_QUEUE", "value": "payment.settlement" },
              { "id": "pa-kafka", "key": "KAFKA_BROKERS", "value": "${events_kafka.host}:9092" },
              { "id": "pa-kafka-topic", "key": "KAFKA_TOPIC", "value": "payment.settled" }
            ],
            "waitStratergy": { "enabled": true, "type": "log", "target": "payment api ready", "timeout": 120 },
            "initScripts": []
          }
        }
      },
      {
        "id": "settlement-worker-node",
        "type": "serviceNode",
        "position": { "x": 240, "y": 260 },
        "data": {
          "label": "settlement_worker",
          "service": {
            "type": "generic",
            "image": "tokyo-test-api:latest",
            "ports": [],
            "env": [
              { "id": "sw-role", "key": "APP_ROLE", "value": "settlement-worker" },
              { "id": "sw-pg-host", "key": "POSTGRES_HOST", "value": "${ledger_postgres.host}" },
              { "id": "sw-pg-port", "key": "POSTGRES_PORT", "value": "5432" },
              { "id": "sw-pg-db", "key": "POSTGRES_DB", "value": "payments" },
              { "id": "sw-pg-user", "key": "POSTGRES_USER", "value": "payments" },
              { "id": "sw-pg-pass", "key": "POSTGRES_PASSWORD", "value": "payments" },
              { "id": "sw-my-host", "key": "MYSQL_HOST", "value": "${merchant_mysql.host}" },
              { "id": "sw-my-port", "key": "MYSQL_PORT", "value": "3306" },
              { "id": "sw-my-db", "key": "MYSQL_DB", "value": "merchants" },
              { "id": "sw-my-user", "key": "MYSQL_USER", "value": "payments" },
              { "id": "sw-my-pass", "key": "MYSQL_PASSWORD", "value": "payments" },
              { "id": "sw-ma-host", "key": "MARIA_HOST", "value": "${risk_mariadb.host}" },
              { "id": "sw-ma-port", "key": "MARIA_PORT", "value": "3306" },
              { "id": "sw-ma-db", "key": "MARIA_DB", "value": "risk" },
              { "id": "sw-ma-user", "key": "MARIA_USER", "value": "payments" },
              { "id": "sw-ma-pass", "key": "MARIA_PASSWORD", "value": "payments" },
              { "id": "sw-red-host", "key": "REDIS_HOST", "value": "${redis_cache.host}" },
              { "id": "sw-red-port", "key": "REDIS_PORT", "value": "6379" },
              { "id": "sw-mem", "key": "MEMCACHED_SERVERS", "value": "${memcached_cache.host}:11211" },
              { "id": "sw-mongo", "key": "MONGODB_URI", "value": "mongodb://audit:audit@${audit_mongodb.host}:27017/?authSource=admin" },
              { "id": "sw-mongo-db", "key": "MONGODB_DATABASE", "value": "payments_audit" },
              { "id": "sw-rabbit", "key": "RABBITMQ_URL", "value": "amqp://payments:payments@${settlement_rabbitmq.host}:5672/" },
              { "id": "sw-rabbit-q", "key": "RABBITMQ_QUEUE", "value": "payment.settlement" },
              { "id": "sw-kafka", "key": "KAFKA_BROKERS", "value": "${events_kafka.host}:9092" },
              { "id": "sw-kafka-topic", "key": "KAFKA_TOPIC", "value": "payment.settled" }
            ],
            "waitStratergy": { "enabled": true, "type": "log", "target": "settlement worker ready", "timeout": 120 },
            "initScripts": []
          }
        }
      },
      {
        "id": "ledger-postgres-node",
        "type": "serviceNode",
        "position": { "x": 480, "y": 20 },
        "data": {
          "label": "ledger_postgres",
          "service": {
            "type": "postgres",
            "ports": [],
            "env": [
              { "id": "pg-db", "key": "POSTGRES_DB", "value": "payments" },
              { "id": "pg-user", "key": "POSTGRES_USER", "value": "payments" },
              { "id": "pg-pass", "key": "POSTGRES_PASSWORD", "value": "payments" }
            ],
            "initScripts": [{
              "id": "pg-schema",
              "order": 1,
              "description": "Payment ledger schema",
              "script": "CREATE TABLE payments (payment_id TEXT PRIMARY KEY, merchant_id TEXT NOT NULL, amount BIGINT NOT NULL, currency CHAR(3) NOT NULL, status TEXT NOT NULL, idempotency_key TEXT NOT NULL UNIQUE, created_at TIMESTAMPTZ NOT NULL DEFAULT NOW(), settled_at TIMESTAMPTZ); CREATE TABLE ledger_entries (entry_key TEXT PRIMARY KEY, payment_id TEXT NOT NULL REFERENCES payments(payment_id), entry_type TEXT NOT NULL, amount BIGINT NOT NULL, created_at TIMESTAMPTZ NOT NULL DEFAULT NOW()); CREATE TABLE settlement_events (event_key TEXT PRIMARY KEY, payment_id TEXT NOT NULL REFERENCES payments(payment_id), published BOOLEAN NOT NULL DEFAULT FALSE, created_at TIMESTAMPTZ NOT NULL DEFAULT NOW());"
            }]
          }
        }
      },
      {
        "id": "merchant-mysql-node",
        "type": "serviceNode",
        "position": { "x": 480, "y": 120 },
        "data": {
          "label": "merchant_mysql",
          "service": {
            "type": "mysql",
            "ports": [],
            "env": [
              { "id": "my-db", "key": "MYSQL_DB", "value": "merchants" },
              { "id": "my-user", "key": "MYSQL_USER", "value": "payments" },
              { "id": "my-pass", "key": "MYSQL_PASSWORD", "value": "payments" }
            ],
            "initScripts": [{ "id": "my-seed", "order": 1, "script": "CREATE TABLE merchants (merchant_id VARCHAR(64) PRIMARY KEY, status VARCHAR(20) NOT NULL); INSERT INTO merchants VALUES ('merchant-demo', 'active');" }]
          }
        }
      },
      {
        "id": "risk-mariadb-node",
        "type": "serviceNode",
        "position": { "x": 480, "y": 220 },
        "data": {
          "label": "risk_mariadb",
          "service": {
            "type": "mariadb",
            "ports": [],
            "env": [
              { "id": "ma-db", "key": "MARIA_DB", "value": "risk" },
              { "id": "ma-user", "key": "MARIA_USER", "value": "payments" },
              { "id": "ma-pass", "key": "MARIA_PASSWORD", "value": "payments" }
            ],
            "initScripts": [{ "id": "ma-seed", "order": 1, "script": "CREATE TABLE risk_rules (currency CHAR(3) PRIMARY KEY, max_amount BIGINT NOT NULL, enabled BOOLEAN NOT NULL); INSERT INTO risk_rules VALUES ('USD', 1000000, TRUE);" }]
          }
        }
      },
      { "id": "redis-node", "type": "serviceNode", "position": { "x": 480, "y": 320 }, "data": { "label": "redis_cache", "service": { "type": "redis", "ports": [], "env": [], "initScripts": [] } } },
      { "id": "memcached-node", "type": "serviceNode", "position": { "x": 680, "y": 20 }, "data": { "label": "memcached_cache", "service": { "type": "memcached", "ports": [], "env": [], "initScripts": [] } } },
      {
        "id": "mongodb-node",
        "type": "serviceNode",
        "position": { "x": 680, "y": 120 },
        "data": { "label": "audit_mongodb", "service": { "type": "mongodb", "ports": [], "env": [
          { "id": "mo-db", "key": "MONGO_INITDB_DATABASE", "value": "payments_audit" },
          { "id": "mo-user", "key": "MONGO_INITDB_ROOT_USERNAME", "value": "audit" },
          { "id": "mo-pass", "key": "MONGO_INITDB_ROOT_PASSWORD", "value": "audit" }
        ], "initScripts": [] } }
      },
      {
        "id": "rabbit-node",
        "type": "serviceNode",
        "position": { "x": 680, "y": 220 },